{
  "schema_version": "1.0.0",
  "project_type": "SDDAI",
  "docs_root": "docs",
  "specs_root": "specs",
  "scripts_root": "scripts",
  "ai_context_root": "ai_context",
  "runs_root": "runs",
  "notes": "Legacy SDDAI marker retained only as a neutral project marker for repo-local detection compatibility. This repo does not ship a dedicated GUI target."
}
